{
  "contract_version": "goodwill-v1",
  "synthetic": true,
  "filters_applied": {
    "start_date": "2026-09-30",
    "end_date": "2026-09-30",
    "source": "not_connected",
    "platform": null,
    "store": null,
    "reporting_timezone": "America/New_York"
  },
  "metric_run_id": null,
  "metrics": [
    {
      "metric_id": "M-DEMO-NET-SALES",
      "metric_version": "demo-net-sales-v1",
      "value": null,
      "unit": "USD",
      "availability": "unavailable",
      "availability_reason": "Required reporting days or full-source report coverage are missing",
      "definition": "Item sales minus refunds; excludes shipping, tax and fees"
    },
    {
      "metric_id": "M-PLATFORM-CUSTOMERS",
      "metric_version": "platform-customers-v1",
      "value": null,
      "unit": "buyers",
      "availability": "unavailable",
      "availability_reason": "Required reporting days or full-source report coverage are missing",
      "definition": "Distinct non-empty buyer IDs within one platform and selected period"
    },
    {
      "metric_id": "R-LABOR-PRODUCTIVITY",
      "metric_version": "roadmap-v1",
      "value": null,
      "unit": "unavailable",
      "availability": "unavailable",
      "availability_reason": "Matched labor hours and allocation policy are unavailable",
      "definition": "Requires approved matching inputs and definitions"
    },
    {
      "metric_id": "R-MARGIN",
      "metric_version": "roadmap-v1",
      "value": null,
      "unit": "unavailable",
      "availability": "unavailable",
      "availability_reason": "Approved costs and allocations are unavailable",
      "definition": "Requires approved matching inputs and definitions"
    },
    {
      "metric_id": "R-SELL-THROUGH",
      "metric_version": "roadmap-v1",
      "value": null,
      "unit": "unavailable",
      "availability": "unavailable",
      "availability_reason": "Approved eligible cohort, window and relist policy are unavailable",
      "definition": "Requires approved matching inputs and definitions"
    },
    {
      "metric_id": "R-REVENUE-GROWTH",
      "metric_version": "roadmap-v1",
      "value": null,
      "unit": "unavailable",
      "availability": "unavailable",
      "availability_reason": "Comparable prior-year inputs are unavailable",
      "definition": "Requires approved matching inputs and definitions"
    }
  ],
  "coverage": {
    "expected_days": [
      "2026-09-30"
    ],
    "complete_days": [],
    "missing_or_partial_days": [
      "2026-09-30"
    ],
    "state": "unavailable"
  },
  "freshness": {
    "published_at": null,
    "latest_import_at": null,
    "is_last_good": false,
    "publication_state": "unpublished",
    "warning": null
  },
  "reconciliation_state": "unpublished",
  "evidence": {
    "row_count": 0,
    "gross_item_sales": null,
    "refunds": null,
    "missing_store_rows": 0
  }
}
